Name,Email,Phone,Website,Address,Source,All_Emails
3OVO Logistics,,(516) 348-1162,http://3ovologistics.com/,"2020 Ocean Ave,, Ronkonkoma, NY, United States, 11779",3plfinder.com,[]
3PL Shipping Inc,,(646) 580-1727,http://www.3pshipping.net/,"19 Heisser Court, Farmingdale, NY, United States, 11735",3plfinder.com,[]
AN Deringer,,(716) 626-5577,http://www.anderinger.com/,"840 Aero Drive, Suite 110, Cheektowaga, NY, United States, 14225",3plfinder.com,[]
AN Deringer,,(518) 298-8281,http://www.anderinger.com/,"173 West Service Road, Champlain, NY, United States, 12919",3plfinder.com,[]
Axis Global Logistics,accountsreceivable@axisg.com,(800) 568-4901,http://axisg.com/,"46-35 54th Road, Maspeth, NY, United States, 11378",3plfinder.com,"['accountsreceivable@axisg.com', 'aviation@axisg.com', 'custsrv@axisg.com', 'accountspayable@axisg.com', 'hr@axisg.com']"
Barrett Distribution Centers,sales@barrettdistribution.com,(607) 304-4801,http://www.barrettdistribution.com/,"24 Elizabeth Drive, Chester, NY, United States, 10918",3plfinder.com,"['sales@barrettdistribution.com', 'mymail@mailservice.com']"
"Benlin Distribution Services, Inc.",,(716) 891-4040,http://www.benlin.com/,"2769 Broadway, Buffalo, NY, United States, 14227",3plfinder.com,[]
Borderworx Logistics,mail@borderworx.com,(716) 216-6714,http://www.borderworx.com/,"6405 Inducon Drive W, Sanborn, NY, United States, 14132",3plfinder.com,"['mail@borderworx.com', 'info@companyname.com']"
"C.R. Hamilton, Inc.",info@crhamilton.com,(800) 932-9876,http://www.crhamilton.com/,"44 Railroad Street, Huntington Station, NY, United States, 11746",3plfinder.com,['info@crhamilton.com']
Captech Logistics,,(518) 355-2704,http://captechlogistics.com/,"1450 Rotterdam Industrial Park, Schenectady, NY, United States, 12306",3plfinder.com,[]
Carrier One Inc.,,(585) 343-3232,http://www.carrier1inc.com/,"56 Harvester Avenue, Batavia, NY, United States, 14020",3plfinder.com,[]
Cold Storage of Nassau,,(516) 333-4466,,"425 Railroad Avenue, Westbury, NY, United States, 11590",3plfinder.com,[]
Complemar,,(800) 388-7254,http://www.complemar.com/,"500 Lee Road, Rochester, NY, United States, 14606",3plfinder.com,[]
Delex Air Cargo LLC,,(718) 553-6500,http://www.delexaircargo.com/,"87 Cargo Plaza Rd, JFK Airport, Jamaica, NY, United States, 11430",3plfinder.com,[]
Distribution Unlimited,sribet@distributionunlimited.com,(518) 355-3112,http://www.disunlt.com/,"Building 11 Rotterdam Industrial Park, Rotterdam, NY, United States, 12306",3plfinder.com,"['sribet@distributionunlimited.com', 'dahl@galesi.com', 'user@domain.com']"
Distribution Unlimited,sribet@distributionunlimited.com,(518) 355-3112,http://www.disunlt.com/,"695 Rotterdam Industrial Park, Schenectady, NY, United States, 12306",3plfinder.com,"['sribet@distributionunlimited.com', 'dahl@galesi.com', 'user@domain.com']"
E & F Warehouse,,(631) 274-4500,http://www.efwarehouse.com/,"15 Grumman Road West - Suite 5, Bethpage, NY, United States, 11714",3plfinder.com,[]
ECS Warehouse,,(716) 829-7356,http://www.ecswarehouse.com/,"2381 Fillmore Avenue, Buffalo, NY, United States, 14214",3plfinder.com,[]
ELM Global Logistics,Info@ELMLogistics.com,(800) 736-1771,http://www.elmlogistics.com/,"50 Emjay Blvd, Brentwood, NY, United States, 11717",3plfinder.com,['Info@ELMLogistics.com']
Elm Global Logistics,Info@ELMLogistics.com,(800) 736-1771,http://www.elmlogistics.com/,"2002 Orville Drive N., Ronkonkoma, NY, United States, 11779",3plfinder.com,['Info@ELMLogistics.com']
Elmwood Warehousing,,(716) 874-2765,http://www.elmwoodwarehousing.com/,"1800 Elmwood Avenue, Buffalo, NY, United States, 14207",3plfinder.com,[]
ESSA Warehouse LLC,ratequote@goessa.com,(800) 627-3664,http://www.goessa.com/,"145 Gruner Road, Cheektowaga, NY, United States, 14227",3plfinder.com,['ratequote@goessa.com']
GoldPack USA,office@goldpackusa.com,(929) 585-5892,http://goldpackusa.com/,"94 Walton Street, Brooklyn, NY, United States, 11206",3plfinder.com,['office@goldpackusa.com']
Hall Street Cold Storage,,(718) 855-3636,http://www.hallstreetstorage.com/,"4-46 Hall Street, Brooklyn, NY, United States, 11205",3plfinder.com,[]
Infinity Trans USA,info@infinitytransusa.com,(516) 887-8188,http://www.infinitytransusa.com/,"14 West Hawthorne Avenue Suite# 100, Valley Stream, NY, United States, 11580",3plfinder.com,['info@infinitytransusa.com']
Innovative Warehouse Solutions,,(844) 446-8947,http://www.invwhs.com/,"70 Austin Blvd, Commack, NY, United States, 11725",3plfinder.com,[]
Intandem Solutions,info@intandemsolutions.org,(716) 375-5500,http://www.intandemsolutions.org/,"338 N 15th St, Olean, NY, United States, 14760",3plfinder.com,['info@intandemsolutions.org']
International Warehouse Group,,(631) 617-5670,http://www.intlwhsegrp.com/,"290 Spagnoli Road, Melville, NY, United States, 11747",3plfinder.com,[]
KMM,,(770) 861-8305,http://www.kmmcorp.net/,"55 Oriskany Blvd, Yorkville, NY, United States, 13495",3plfinder.com,[]
KPM Exceptional,info@kpmlogisticspartners.com,(716) 604-8026,http://kpm4logistics.com/,"1393 Wisconsin Road, Derby, NY, United States, 14219",3plfinder.com,['info@kpmlogisticspartners.com']
Laser Transit,ask@lasertransit.com,(315) 219-4552,http://www.lasertransit.com/,"19 Demott Street, Lacona, NY, United States, 13083",3plfinder.com,['ask@lasertransit.com']
Laub International,laub@laubinternational.com,(716) 853-3703,http://www.laubinternational.com/,"1051 Clinton Street, Buffalo, NY, United States, 14206",3plfinder.com,['laub@laubinternational.com']
Lincoln Warehousing,,(716) 823-2142,http://lincolnwarehousing.com/,"3955 Eastbourne Drive, Syracuse, NY, United States, 13206",3plfinder.com,[]
Lincoln Warehousing,,(800) 344-3915,http://lincolnwarehousing.com/,"155 Great Arrow, Buffalo, NY, United States, 14207",3plfinder.com,[]
Lincoln Warehousing,,(716) 823-2142,http://lincolnwarehousing.com/,"10 North Gates Avenue, Lackawanna, NY, United States, 14218",3plfinder.com,[]
Logistics One,scott.logisticsone@gmail.com,(518) 587-3798,http://www.logisticsone.com/,"33 Cady Hill Boulevard, Saratoga Springs, NY, United States, 12866",3plfinder.com,['scott.logisticsone@gmail.com']
Logistics One,scott.logisticsone@gmail.com,(518) 587-3700,http://www.logisticsone.com/,"33 Cady Hill Boulevard, Saratoga Springs, NY, United States, 12866",3plfinder.com,['scott.logisticsone@gmail.com']
Logistics Plus Inc.,truckload@logisticsplus.com,(866) 564-7587,http://www.logisticsplus.com/,"2251 Constitution Ave, Olean, NY, United States, 14760",3plfinder.com,"['truckload@logisticsplus.com', 'acct@logisticsplus.com', 'LTL@logisticsplus.com', 'international@logisticsplus.com', 'hr@logisticsplus.com', 'aircharter@logisticsplus.com', 'nadsales@logisticsplus.com', 'pc-quotes@logisticsplus.com', 'pricing@logisticsplus.com', 'marketing@logisticsplus.com', 'quotes@logisticsplus.com']"
Lynx Fulfillment,,(716) 213-6145,http://lynxfulfillment.com/,"243 Root Street Suite 400, Olean, NY, United States, 14760",3plfinder.com,[]
M & M Forwarding of Buffalo,,(800) 874-1825,http://wwwmmforward.com/,"600 Main Street, Tonawanda, NY, United States, 14150",3plfinder.com,[]
McGuire Trucking Service,,(631) 580-4777,http://www.mcguirestrucking.com/,"150 Sherwood Avenue, Ronkonkoma, NY, United States, 11779",3plfinder.com,[]
Medina Cold Storage,,(585) 798-3811,http://www.medinacoldstorage.com/,"630 Main Street / Route 63, Medina, NY, United States, 14103",3plfinder.com,[]
Mercedes Distribution Center,,(718) 534-3002,http://www.mdist.com/,"Brooklyn Navy Yard 63 Flushing Avenue, Unit 340, Brooklyn, NY, United States, 11205",3plfinder.com,[]
New York Frozen Storage & Fulfillment,sales@lifrozenstorage.com,(516) 827-5616,http://www.lifrozenstorage.com/,"25 Charlotte Avenue, Hicksville, NY, United States, 11801",3plfinder.com,"['sales@lifrozenstorage.com', 'user@domain.com']"
NY Fulfillmemts,,(866) 252-2411,http://www.newyorkfulfillments.com/,"110 Industrial Road Unit C, New Windsor, NY, United States, 12553",3plfinder.com,[]
NY Fulfillmemts,,(866) 252-2411,http://www.newyorkfulfillments.com/,"106 Pierces Rd, 106 Pierces Rd, NY, United States, 12550",3plfinder.com,[]
Pioneer Warehousing & Distribution,,(315) 451-3101,http://www.pioneerwhs.com/,"7640 Edgecomb Drive, Liverpool, NY, United States, 13088",3plfinder.com,[]
Prompt Warehousing,sales@promptwarehousing.com,(718) 927-2222,http://www.promptapparel.com/,"10101 Foster Avenue, Brooklyn, NY, United States, 11236",3plfinder.com,['sales@promptwarehousing.com']
Railex,,(888) 472-4539,http://railex.com/,"105 Rotterdam Industrial Park, Rotterdam, NY, United States, 12306",3plfinder.com,[]
Regional Logistics Group,mhale@rilinc.com,(716) 876-4645,http://www.rilinc.com/,"120 Dart Street, Buffalo, NY, United States, 14213",3plfinder.com,['mhale@rilinc.com']
Riegel Warehouse,,(631) 205-0900,http://www.riegelwarehouse.com/,"445 County Road 101, Long Island, NY, United States, 11980",3plfinder.com,[]
Rogers Service Group,mzemanick@rogersservicegroup.com,(800) 444-7885,http://www.rogersservicegroup.com/,"245 Clinton Street, Binghamton, NY, United States, 13905",3plfinder.com,['mzemanick@rogersservicegroup.com']
Rontondo Warehouse,,(315) 457-4211,http://www.rotondowarehouse.com/,"4474 Steelway Boulevard, Liverpool, NY, United States, 13090",3plfinder.com,[]
Sandell Transport,impallari@gmail.com,(518) 688-3029,http://sandelltransport.com/,"310 Wayto Road, Schenectady, NY, United States, 12303",3plfinder.com,"['impallari@gmail.com', 'hello@rfuenzalida.com']"
Sonwil Distribution Center,sales@sonwil.com,(716) 684-0555,http://www.sonwil.com/,"611 Jamison Road, Elma, NY, United States, 14059",3plfinder.com,['sales@sonwil.com']
Sonwil Distribution Center,sales@sonwil.com,(716) 206-1800,http://www.sonwil.com/,"5100 North America Drive, West Seneca, NY, United States, 14224",3plfinder.com,['sales@sonwil.com']
Sonwil Distribution Center,sales@sonwil.com,(716) 684-0555,http://www.sonwil.com/,"4900 North America Drive, West Seneca, NY, United States, 14224",3plfinder.com,['sales@sonwil.com']
Sonwil Distribution Center,sales@sonwil.com,(716) 206-1800,http://www.sonwil.com/,"4900 North America Drive, West Seneca, NY, United States, 14224",3plfinder.com,['sales@sonwil.com']
Sonwil Distribution Center,sales@sonwil.com,(716) 684-0555,http://www.sonwil.com/,"3200 North America Drive, West Seneca, NY, United States, 14224",3plfinder.com,['sales@sonwil.com']
Sonwil Distribution Center,sales@sonwil.com,(716) 684-0555,http://www.sonwil.com/,"315 Ship Canal Parkway, Buffalo, NY, United States, 14218",3plfinder.com,['sales@sonwil.com']
Sonwil Distribution Center,sales@sonwil.com,(716) 206-1800,http://www.sonwil.com/,"315 Ship Canal Parkway, Buffalo, NY, United States, 14218",3plfinder.com,['sales@sonwil.com']
Sonwil Distribution Center,sales@sonwil.com,(716) 206-1800,http://www.sonwil.com/,"283 Ship Canal Parkway, Buffalo, NY, United States, 14218",3plfinder.com,['sales@sonwil.com']
Sonwil Distribution Center,sales@sonwil.com,(716) 684-0555,http://www.sonwil.com/,"2475 George Urban Blvd, Depew, NY, United States, 14043",3plfinder.com,['sales@sonwil.com']
Sonwil Distribution Center,sales@sonwil.com,(716) 206-1800,http://www.sonwil.com/,"2475 George Urban Blvd, Depew, NY, United States, 14043",3plfinder.com,['sales@sonwil.com']
Sonwil Distribution Center,sales@sonwil.com,(716) 684-0555,http://www.sonwil.com/,"200 Sonwil Drive, Buffalo, NY, United States, 14225",3plfinder.com,['sales@sonwil.com']
Sonwil Distribution Center,sales@sonwil.com,(716) 206-1800,http://www.sonwil.com/,"200 Sonwil Drive, Buffalo, NY, United States, 14226",3plfinder.com,['sales@sonwil.com']
Sonwil Distribution Center,sales@sonwil.com,(716) 206-1800,http://www.sonwil.com/,"105 Taylor Drive, Depew, NY, United States, 14043",3plfinder.com,['sales@sonwil.com']
Sonwil Distribution Center,sales@sonwil.com,(716) 206-1800,http://www.sonwil.com/,"100 Sonwil Drive, Buffalo, NY, United States, 14225",3plfinder.com,['sales@sonwil.com']
Soucy USA,info@soucy-group.com,(518) 298-3099,http://www.soucyusa.com/,"100 Walnut Street, Champlain, NY, United States, 12919",3plfinder.com,"['info@soucy-group.com', 'gary.boulerice@soucy-group.com']"
Southern Tier Logistics,,(607) 936-9414,http://www.ohiologistics.com/warehousing/new-york,"736 Addison Road, Painted Post, NY, United States, 14870",3plfinder.com,[]
Southern Tier Logistics,,(607) 936-9414,http://www.ohiologistics.com/,"736 Addison Road, Painted Post, NY, United States, 14870",3plfinder.com,[]
Southern Tier Logistics,,(607) 936-9414,http://www.ohiologistics.com/,"50 Electric Parkway, Horseheads, NY, United States, 14845",3plfinder.com,[]
Southern Tier Logistics,,(607) 936-9414,http://www.ohiologistics.com/,"340 Upper Oakwood, Elmira Heights, NY, United States, 14903",3plfinder.com,[]
Southern Tier Logistics,,(607) 936-9414,http://www.ohiologistics.com/,"1051 South Main Street, Elmira, NY, United States, 14870",3plfinder.com,[]
Speed Global Services,ask@SpeedGS.com,(716) 876-2235,http://www.speedgs.com/,"2299 Kenmore Avenue, Buffalo, NY, United States, 14207",3plfinder.com,['ask@SpeedGS.com']
Stone Management Inc.,,(518) 272-2136,http://www.stone-mgt.com/,"2622 Seventh Avenue, Watervliet, NY, United States, 12189",3plfinder.com,[]
Stronghold Warehouse,info@strongholdwarehouse.net,(347) 529-5121,http://www.strongholdwarehouse.net/,"72-40 60th Lane, Glendale, NY, United States, 11385",3plfinder.com,['info@strongholdwarehouse.net']
Stronghold Warehouse,info@strongholdwarehouse.net,(347) 529-5121,http://www.strongholdwarehouse.net/,"66-11 Otto Road, Glendale, NY, United States, 11385",3plfinder.com,['info@strongholdwarehouse.net']
Superior Logistics & Warehousing,,(716) 835-2910,http://www.superiorwarehousing.com/,"60 Clyde Avenue, Buffalo, NY, United States, 14215",3plfinder.com,[]
Supership – A Canadian Superhero in eCommerce Growth,,(647) 598-4039,https://www.supership.to/,"73 Millwick Dr, North York, ON, Canada",3plfinder.com,[]
Taylor Logistics,,(513) 771-1850,http://www.taylorlogistics.com/,"1216 Broadway, New York, NY, United States, 10001",3plfinder.com,[]
TradeTrans Corporation,info@tradetranscorp.com,(845) 469-1000,http://www.tradetranscorp.com/,"173 Black Meadow Road, Chester, NY, United States, 10918",3plfinder.com,['info@tradetranscorp.com']
Universal Warehousing,mhathaway@schoolhouseco.net,(518) 725-6960,http://www.universalwarehousing.com/,"204 County Highway 157, Gloversville, NY, United States, 12078",3plfinder.com,"['mhathaway@schoolhouseco.net', 'dgroff@schoolhouseco.net', 'nolbrych@schoolhouseco.net', 'aolbrych@schoolhouseco.net', 'tzemken@schoolhouseco.net']"
Warehouse Anywhere,,(855) 671-4820,http://www.warehouseanywhere.com/,"6467 Main Street, Buffalo, NY, United States, 14221",3plfinder.com,[]
Warehousing & Distributive Management,wdms@wareroc.com,(585) 328-1000,http://www.wareroc.com/,"44 Jetview Drive, Rochester, NY, United States, 14624",3plfinder.com,['wdms@wareroc.com']
Wen-Parker Logistics,info@wen-parker.com,(888) 978-3029,http://www.wen-parker.com/,"1975 Linden Boulevard, Suite 420, Elmont, NY, United States, 11003",3plfinder.com,['info@wen-parker.com']
Western New York Foreign Trade Zone,jpalisano@wnyftz.com,(716) 823-2142,http://wnyftz.com/,"10 North Gates Avenue, Buffalo, NY, United States, 14218",3plfinder.com,['jpalisano@wnyftz.com']
Whalen’s Moving & Storage,info@movewhalens.com,(914) 241-1711,http://www.movewhalens.com/,"301 Fields Lane, Brewster, NY, United States, 10509",3plfinder.com,['info@movewhalens.com']
Worldwide Shipping Center,info@worldwideshippingcenter.us,(516) 305-4032,http://worldwideshippingcenter.us/,"329, Jericho Turnpike, Floral Park, NY, United States, 11001",3plfinder.com,"['info@worldwideshippingcenter.us', 'worldwideshippingcenter14@gmail.com']"
